Nome da Vaga;Nome da Empresa;Nível de Experiência;Data de Publicação;Faixa Salarial;Localização;Modelo Contratual;Benefícios;Descrição do Cargo;Descrição da Empresa
Pessoa Analista de Dados - Senior;NIVEA;Sênior;Publicada em 20/09/2024;a combinar;São Paulo;Regime CLT;Assistência médica + Assistência odontológica + Auxílio academia + Auxílio creche + Auxílio estacionamento + Desconto em produtos;O (a) profissional irá apoiar na construção da área de Data Analytics, em desenvolvimento, dentro da diretoria de vendas e será responsável por suportar o time, com a criação de novos relatórios e análises, além de garantir a acuracidade das informações geridas pela área.  Responsabilidades:  Criação de análises e relatórios comerciais. Desenvolvimento de relatórios com data sets do Power BI. Atualização de informações comerciais. Gestão dos cadastros e hierarquias comerciais no SAP. Gestão das despesas comerciais.  Requisitos e Conhecimentos:  Saber criar relatórios com datasets do Power BI (front-end). Vivência na área de manipulação de dados comerciais (sell in, sell out e estoque) Familiaridade no tratamento de dados de diferentes provedores de dados (MTRIX, Scanntech, IQVIA, Neogrid e Nielsen) Vivência com rotinas do sistema SAP Excel avançado (saber utilizar macros e power pivot são um diferencial).  Inglês - Nível Básico;Com mais de 140 anos de experiência em cuidados com a pele e um dos mais modernos centros de pesquisa do mundo, Beiersdorf é sinônimo de cosméticos inovadores e de alta qualidade.  Nossas marcas possuem confiança universal - desde NIVEA, uma das maiores marcas em cuidado da pele no mundo, a outras marcas internacionalmente bem-sucedidas, como Eucerin, La Prairie, Labello, 8×4 e Hansaplast/Elastoplast.  Nossos colaboradores adoram trabalhar na Beiersdorf e se sentem orgulhosos da empresa, seus valores e suas marcas. Seu alto desempenho e comprometimento impulsionam o desenvolvimento do grupo.  Incentivamos esse desempenho com tarefas desafiadoras e responsabilidades abrangentes, para que nossos colaboradores se superem em todos os campos de nosso negócio, todos os dias, desde o início de sua carreira.  Nossa atmosfera de trabalho é amigável, com uma combinação única de espírito vencedor e trabalho em equipe, ao mesmo tempo voltada à busca de resultados.  Valorizamos o sucesso e sabemos que, para alcançá-lo, as pessoas são recursos imprescindíveis.
TI Analista de Dados Pleno / Sênior;Epimed Solutions;Sênior;Publicada há 5 dias;a combinar;100% Home Office;Pessoa Jurídica;; A Epimed Solutions é uma empresa líder no mercado de gestão de informações clínicas, especializada no desenvolvimento de sistemas de monitoramento de dados clínicos e epidemiológicos, que tem como principal objetivo melhorar a qualidade e eficiência do atendimento hospitalar. Buscamos profissionais diferenciados no mercado que desejem fazer parte no nosso time para a posição de:;
Analista de Dados - CRM;A.C.Camargo Cancer Center;Pleno;Publicada em 12/09/2024;a combinar;São Paulo;Regime CLT;Assistência médica + Assistência odontológica + Auxílio creche + Seguro de vida + Vale-alimentação + Vale-refeição;" Você será responsável por:  Administrar e otimizar as estratégias de CRM, garantindo a integridade dos dados e a eficácia das campanhas;  Desenvolver e implementar bases e regras de comunicação personalizadas para otimizar o engajamento dos públicos impactados nas diversas plataformas;  Desenhar réguas e automatizá-las dentro das nossas plataformas; Realizar análises detalhadas dos disparos, gerando insights para melhorar a segmentação e o engajamento;  Criar e manter relatórios e dashboards que auxiliem na tomada de decisão estratégica;  Colaborar na integração do CRM com outras ferramentas e plataformas utilizadas pela empresa;  Treinar e orientar a equipe sobre melhores práticas e funcionalidades do sistema de CRM utilizado.    O que você precisa ter:  Educação Superior completa: Tecnologia da Informação, Administração, Marketing ou áreas afins.   Conhecimentos:  Proficiência em ferramentas de CRM (por exemplo, Salesforce, HubSpot), SQL e Excel avançado.  Perfil analítico, capacidade de interpretar dados e transformar insights em ações estratégicas.   Desejável:  Certificações em ferramentas de CRM ou análise de dados.  Experiência com automação de marketing e integração de sistemas.   Sua jornada de trabalho será:  Segunda a sexta 8h às 18h – sexta 8h às 17h    Seu local de trabalho será:  Unidade de trabalho: Castro Alves.    ";"Você já pensou em trabalhar em uma Instituição que ao longo de 70 anos constrói diariamente um legado importante para a sociedade. Um Cancer Center, além de ter a assistência, o ensino e a pesquisa alinhados, também entende o entorno; estuda e devolve à população, favorecendo a produção e disseminação ativa dos conhecimentos. De onde viemos e para onde vamos fazem parte de uma narrativa que olha nossa essência do cuidar como vocação há 7 décadas. Existimos pelo e para o paciente, que é o centro dos nossos esforços coordenados e integrados e temos o compromisso social de promover e oferecer oportunidades igualitárias de crescimento e desenvolvimento para nossos funcionários. Valorizamos as pessoas, construindo uma cultura acolhedora e de respeito a todos e todas. Seja quem você é aqui! Somos especializados em saúde oncológica. Somos especializados em vida!"
Administrador de Banco de Dados;CIEE;Sênior;Publicada há 6 dias;a combinar;São Paulo;Regime CLT;Assistência médica + Assistência odontológica + Auxílio academia + Consignado + Horário flexível + Massoterapia;Inglês - Nível Intermediário;O Centro de Integração Empresa Escola - CIEE é uma instituição filantrópica sem fins lucrativos e de fins não econômicos, reconhecida como entidade de assistência social que, por meio de diversos programas, dentre eles o de aprendizagem e o estágio de estudantes, possibilita aos adolescentes e jovens uma formação integral, ingressando-os ao mundo do trabalho.   O CIEE tem um programa de diversidade que acolhe e respeita como você é e como quiser ser!
Analista de Engenharia de Dados Jr;Grupo Fleury;Júnior/ Trainee;Publicada em 10/09/2024;a combinar;100% Home Office;Regime CLT;; O Grupo Fleury é uma das maiores e mais respeitadas instituições de medicina e saúde do Brasil. Referência por sua excelência técnica, médica e de atendimento, é também destaque nas melhores práticas ESG.  Além dos serviços de medicina diagnóstica, o Grupo Fleury conta com uma oferta crescente de serviços que buscam responder às necessidades das pessoas, além de gerar sustentabilidade para o sistema de saúde com a melhor utilização dos recursos investidos. Essas soluções refletem o posicionamento estratégico da empresa de ser um ecossistema de saúde integrada, preventiva e híbrida, combinando ofertas físicas e digitais.  Acreditamos que carreira e propósito caminham juntos, e costumamos falar que somos apaixonados pelas pessoas e pelo que fazemos. Isso reflete em nosso dia a dia, por meio de um trabalho que impacta vidas. Faz parte da nossa essência cuidar das pessoas, colocando as colaboradoras, colaboradores, médicas, médicos e clientes sempre no centro.  Se você tem atitude positiva, empatia, adaptabilidade e deseja se desenvolver em um ambiente repleto de profissionais referências no mercado que prezam por respeito, excelência e inovação, abrace a oportunidade de levar saúde e bem-estar para a plena realização das pessoas!  Venha transformar sua paixão em carreira!;
Analista de Inteligência de Dados Jr.;Hire Now Company;Júnior/ Trainee;Publicada em 24/09/2024;a combinar;Rio de Janeiro;Regime CLT;; A Hire Now® é uma empresa global, especializada em recrutamento e alocação de profissionais. Nossa metodologia combina tecnologia de ponta e gestão humanizada, com soluções 100% customizadas, entregando a melhor experiência para o profissional alocado e o cliente.  Com foco no negócio e cultura organizacional de cada empresa, nossas equipes são formadas por profissionais multidisciplinares, que cumprem rigorosos critérios de qualidade técnica e governança corporativa. ;
Estágio Universitário de Dados;Gerdau;Estágio;Publicada em 12/09/2024;a combinar;São Paulo;Estágio;Assistência médica + Assistência odontológica + Auxílio academia + Café da manhã + Refeitório + Seguro de vida;" A Gerdau, uma multinacional brasileira, está contratando Estagiário (a) Universitário (a) de Dados para Comercial Gerdau de São Caetano do Sul- SP.  Nós buscamos pessoas que sejam apaixonadas por desafios, que estimule a criação de um ambiente diverso, que tenha a segurança como valor inegociável e que se motivem pela oportunidade de empoderar pessoas.   Se interessou? Veja a descrição da atividade e candidate-se.   O (a) Estagiário (a) de Dados, vai desempenhar atividades na área de Planejamento e Projetos Logísticos da Comercial Gerdau, auxiliando na busca de dados e construção de informações que possam colaborar na melhoria contínua do serviço prestado ao cliente, além de participar ativamente na implantação de projetos que visam otimizar e tornar mais produtivo os processos logísticos das unidades.   Como escopo do trabalho, deverá:  Construção e manutenção de painéis, indicadores e dashboards;  Auxílio na divulgação e monitoramento dos projetos da área;  Consolidação de bases de dados;  Realização de consultas em banco de dados para validação e análises;  Auxílio na definição da modelagem de dados a serem tratados e transformados;  Suporte no mapeamento de processos logísticos;  Suporte nos eventos e planos de melhoria contínua e mudança de fluxos operacionais;  Suporte na implementação de ferramentas de melhoria contínua.   Requisitos:  Cursando Superior em Logística, Supply Chain ou áreas correlatas;  Pacote Office intermediário;  Residir em São Caetano do Sul/SP ou regiões próximas;  O que desejamos?  Bom relacionamento interpessoal e capacidade de trabalho em equipe; Disciplina e iniciativa; Boa comunicação.   O que oferecemos?  Bolsa auxílio; Assistência médica hospitalar UNIMED Nacional: sem carência, modalidade enfermaria ou apartamento (conforme sua opção); Pronto atendimento virtual do Hospital Albert Einstein (sem custo); Assistência odontológica MetLife; Vale alimentação; Benefício farmácia; Vale transporte ou estacionamento no local; Seguro de vida; Programa +Cuidado: assistência profissional e confidencial para problemas pessoais (sem custo).";Somos a Gerdau.  Somos 30 mil colaboradores, com presença industrial em 12 países.  Produzimos aços longos, especiais, planos e minério de ferro para atender cerca de 100 mil clientes de setores da construção civil, indústria, agropecuário, automotivo, energia eólica, óleo e gás, açúcar e álcool, rodoviário e naval.  Somos a maior recicladora de sucata ferrosa da América Latina. Somos carros, aviões e pontes que conectam pessoas. Somos casas que registram histórias. Começos e recomeços.  E estamos criando uma nova Gerdau. Empoderando pessoas que constroem o futuro. De forma mais aberta, mais digital, com processos mais simples e fluidos, mais ágil para inovar e ir além.  Nós buscamos pessoas que sejam apaixonadas por desafios, que estimulem a criação de um ambiente diverso, que tenha a segurança como valor inegociável e que se motivem pela oportunidade de empoderar pessoas.  Se você quer construir o futuro com a gente, vem fazer parte do nosso time!
Estágio em Precificação, Análise e Aceitação de Riscos (Udw);Metlife;Estágio;Publicada há 7 dias;a combinar;São Paulo;Estágio;Assistência médica + Assistência odontológica + Auxílio academia + Bolsa auxílio + Desconto em produtos + Horário flexível;"O propósito da posição:  Dar suporte à área de Underwriting e Pricing Dental fazendo a subscrição de planos odontológicos empresariais, viabilizando a expansão do negócio e garantindo a saúde financeira da carteira. Além disso, a pessoa atuará no levantamento de dados para gerar, atualizar e acompanhar relatórios gerenciais e indicadores do negócio.  Quem buscamos?  • Perfil analítico; • Senso crítico; • Organização; • Boa comunicação verbal e escrita; • Bom relacionamento pessoal;  O que precisa ter ou saber?  • Formação acadêmica: cursando Ciências Atuariais, Estatística, Economia, Administração, Finanças ou áreas correlatas; • Conhecimentos no pacote Office, foco em Excel; • Competências em senso de urgência, dinamismo, boa comunicação e proatividade;  Desejável/Diferenciais:  Principais responsabilidades ou desafios:  • Subscrever e cotar as propostas de planos odontológicos empresariais; • Apoiar as rotinas de precificação para novos negócios e pós-vendas; • Gerar e acompanhar indicadores e relatórios da área; • Atuar pontualmente em estudos técnicos; • Suporte e relacionamento com áreas parceiras (comercial, operações, sinistros, rede credenciada etc.).  O que oferecemos?  • Salário competitivo; • Vale-transporte; • Vale Refeição • Assistência médica; • Assistência odontológica; • Seguro de vida; • Gympass; • 13° Salário • Day off de aniversário ";Na MetLife, você será parte de um time que trabalha com muita paixão, colaboração e acolhimento. Aqui, temos um ambiente de trabalho inclusivo, onde todos podem ser quem são! 
Analista Gestao Sinistros Pl e Sr - Dados;SulAmérica;Sênior;Publicada em 23/09/2024;a combinar;São Paulo;Regime CLT;Assistência médica + Assistência odontológica + Auxílio creche + Participação nos Lucros ou Resultados + Previdência privada + Seguro de vida;"Oportunidade para atuar no time de análise de sinistro saúde, afim de identificar oportunidade de contenção de custos com as seguintes responsabilidades: - Elaboração de estudos de comportamento de custos, através da análise detalhada de sinistros de internações, pronto socorro, consultas, exames, terapias e procedimentos, visando mapeamento de cenário e indicação de insights para melhor gestão de custos. - Avaliar, comunicar e buscar alternativas em eventuais desvios de comportamento ou possíveis fraudes no processo de faturamento de prestadores (hospitais, clínicas, consultórios e laboratórios); - Desenvolvimento de indicadores para tomada de decisão pela equipe de gestão (diretoria, superintendências e gerência); - Fornecer ferramentas automatizadas relacionadas aos indicadores de custos e suporte às áreas pares; - Realizar reuniões com áreas parcerias para entendimento, discussão e alinhamento de questões técnicas e operacionais relacionadas aos estudos de sinistro; - Atuar como ponto focal no suporte nas ações financeiras da diretoria (metas, apuração de resultados e impactos relacionados a prestação de serviço por nossa rede referenciada). - Conduzir as ações e projetos de data analytics da diretoria, com foco na digitalização e ganho na escala das análises para controle de custos do departamento. - Ensino Superior completo em Estatística, Matemática, Ciências Atuariais ou áreas correlatas; - Experiência em análise de dados, elaboração de relatórios e indicadores; - Experiência em manipulação de banco de dados e ferramentas de analytics; - Conhecimento em indicadores econômicos e financeiros; - Conhecimento em princípios de inteligência competitiva/mercado; - Conhecimento de estatística e/ou matemática financeira. ";A SulAmérica há mais de 125 anos se dedica a entregar Saúde Integral para mais de 7 milhões de clientes por meio de produtos e serviços de Saúde, Odonto, Vida, Previdência e Investimentos. Temos como missão melhorar a vida das pessoas, oferecendo apoio, segurança e autonomia em cada momento e decisão de saúde física, emocional e financeira. Para isso, contamos com mais de 4 mil colaboradores(as) engajados(as) e comprometidos(as).  Acreditamos que por meio da inclusão e da diversidade construímos um ambiente seguro e de pertencimento que valoriza e respeita as pessoas integralmente. Assim, incentivamos a candidatura de pessoas com deficiência, de diferentes raças e etnias, gêneros, orientações sexuais, identidades de gênero e gerações para todas as nossas vagas.
Analista de Informações Gerenciais Jr. (Dados);Confidencial;Júnior/ Trainee;Publicada há 2 dias;a combinar;Jundiaí;Regime CLT;Assistência médica + Assistência odontológica + Café da manhã + Cesta básica + Cesta de natal + Consignado;"Gerar informações referentes aos subsistemas de RH; Elaborar e analisar relatórios gerencias; Criar, acompanhar e atualizar indicadores (KPIs) da área de RH; Apoiar o time de RH na geração e consolidação de informações da área; Atender demandas BPRH Brasil; Divulgar e atualizar Programa de Excelência das áreas de BackOffice;   Formação superior completa em Adm. de Empresas, Gestão de RH ou áreas similares; Conhecimento em Excel, Power Point avançado (análise de dados, formulas diversas, gráficos e apresentação de resultados);. Desejável conhecimento em Power BI; Experiência em elaboração de relatórios gerencias, indicadores e criação de dashboards;";
Analista de Dados de Saúde e Odonto Jr;SulAmérica;Júnior/ Trainee;Publicada em 19/09/2024;a combinar;São Paulo;Regime CLT;Assistência médica + Assistência odontológica + Auxílio creche + Participação nos Lucros ou Resultados + Previdência privada + Seguro de vida;"Oportunidade para atuar junto ao time de dados, com as seguintes atividades: - Atuar em conjunto com outras áreas de negócio; - Entender a necessidade e os dados disponíveis para a construção de indicadores; - Capacidade para interpretar dados, descobrindo padrões e tendências, utilizando técnicas de exploração, visualização e storytelling; - Conduzir estudos de ponta a ponta com técnicas de análise de dados; - Desenvolver dashboards e construir pipelines de dados; - Explicar as análises para diversos públicos com clareza e objetividade; - Entre outras atividades.  Pré-requisitos: • Graduação superior cursando ou completo; • Conhecimento em SQL; • Experiência com ferramentas de visualização de dados para reportar dados e conduzir insights; • Noções de Estatística, será um diferencial.";A SulAmérica há mais de 125 anos se dedica a entregar Saúde Integral para mais de 7 milhões de clientes por meio de produtos e serviços de Saúde, Odonto, Vida, Previdência e Investimentos. Temos como missão melhorar a vida das pessoas, oferecendo apoio, segurança e autonomia em cada momento e decisão de saúde física, emocional e financeira. Para isso, contamos com mais de 4 mil colaboradores(as) engajados(as) e comprometidos(as).  Acreditamos que por meio da inclusão e da diversidade construímos um ambiente seguro e de pertencimento que valoriza e respeita as pessoas integralmente. Assim, incentivamos a candidatura de pessoas com deficiência, de diferentes raças e etnias, gêneros, orientações sexuais, identidades de gênero e gerações para todas as nossas vagas.
Analista de Dados de Saúde e Odonto Sr;SulAmérica;Sênior;Publicada em 19/09/2024;a combinar;São Paulo;Regime CLT;Assistência médica + Assistência odontológica + Auxílio creche + Participação nos Lucros ou Resultados + Previdência privada + Seguro de vida;"Oportunidade para atuar na área de dados do Sinistro Saúde e Odonto, desenvolvendo as seguintes atividades: Realizar atendimento às Regionais, com o controle de custos e sinistros saúde e odonto, utilizando como ferramenta deste controle modelos alternativos de pagamento como Pacotes, Diárias Globalizadas, bundles, etc., Garantir a correta elaboração de tabelas de reajustes dos prestadores e entregar estudos de preços. Desenvolver estudos de custos com velocidade, qualidade e assertividade, além de garantir a replicação em escala destas entregas. Desenvolver estudos sinistros nos prazos e condições necessárias para tomada de decisões pelo corpo executivo. Apoiar na distribuição de conhecimento e ser um apoio à gestão na formação de novos colaboradores e manutenção das demandas da área, orientando os analistas mais juniores.  Pré-requisitos: • Graduação superior completa preferencialmente em Exatas (Atuária, Matemática, Gestão Hospitalar, entre outras); • Necessário conhecimento em análise de custos e precificação; • Domínio de Pacote Office (Word, Excel, Powerpoint etc), com ênfase ao nível avançado para Excel; • Conhecimento das tabelas de remuneração de honorários médicos (AMB, CBHPM, TUSS, Brasindice e SIMPRO) aplicáveis à Saúde Suplementar; • Ter conhecimento em análise de dados, ou métodos estatísticos; • Necessário experiencia com SQL.";A SulAmérica há mais de 125 anos se dedica a entregar Saúde Integral para mais de 7 milhões de clientes por meio de produtos e serviços de Saúde, Odonto, Vida, Previdência e Investimentos. Temos como missão melhorar a vida das pessoas, oferecendo apoio, segurança e autonomia em cada momento e decisão de saúde física, emocional e financeira. Para isso, contamos com mais de 4 mil colaboradores(as) engajados(as) e comprometidos(as).  Acreditamos que por meio da inclusão e da diversidade construímos um ambiente seguro e de pertencimento que valoriza e respeita as pessoas integralmente. Assim, incentivamos a candidatura de pessoas com deficiência, de diferentes raças e etnias, gêneros, orientações sexuais, identidades de gênero e gerações para todas as nossas vagas.
Analista de Dados - Área da Saúde;SulAmérica;Sênior;Publicada há 2 dias;a combinar;São Paulo;Regime CLT;Assistência médica + Assistência odontológica + Auxílio creche + Previdência privada + Seguro de vida + Vale-alimentação;Estruturar os dados de sinistro para extrair relatórios que possibilitem a gestão do pagamento do sinistro rede e reembolso. Criar bases de dados no BQ de forma estruturada e homologada, bem como, prover a sustentação e manutenção destas bases. Elaborar dashboards no Data Studio e analisar indicadores para identificar comportamentos de aumento e queda e ofensores e oportunidades de melhoria de resultado. Elaborar Querys para extração de amostra de dados.  Necessário experiencia em operadora/seguradora de saúde.  Ensino Superior Completo (Atuarial, Matemática, Sistemas de Informação ou áreas correlatas). Conhecimento e experiência em: Indicadores, Relatórios Gerenciais, Noções Estatística, Gerenciamento de Banco de Dados. Domínio Oracle, Big Query, SAS Guide, Datastudio, Tableau, pacote office e excel avançado. ;A SulAmérica há mais de 125 anos se dedica a entregar Saúde Integral para mais de 7 milhões de clientes por meio de produtos e serviços de Saúde, Odonto, Vida, Previdência e Investimentos. Temos como missão melhorar a vida das pessoas, oferecendo apoio, segurança e autonomia em cada momento e decisão de saúde física, emocional e financeira. Para isso, contamos com mais de 4 mil colaboradores(as) engajados(as) e comprometidos(as).  Acreditamos que por meio da inclusão e da diversidade construímos um ambiente seguro e de pertencimento que valoriza e respeita as pessoas integralmente. Assim, incentivamos a candidatura de pessoas com deficiência, de diferentes raças e etnias, gêneros, orientações sexuais, identidades de gênero e gerações para todas as nossas vagas.
