Nome da Vaga;Nome da Empresa;Nível de Experiência;Data de Publicação;Faixa Salarial;Localização;Modelo Contratual;Benefícios;Descrição do Cargo;Descrição da Empresa
Analista Planejamento Jr;Linha Amarela S/A;Júnior/ Trainee;Publicada em 01/10/2024;R$ 3.042;Rio de Janeiro;Regime CLT;Assistência médica + Assistência odontológica + Auxílio creche + Cesta de natal + Consignado + Participação nos Lucros ou Resultados;"Estamos em busca de um Analista de Planejamento Jr para se juntar à nossa equipe! Se você é uma pessoa organizada, analítica e com habilidades em planejamento, essa pode ser a oportunidade que você estava procurando.  Responsabilidades: - Realizar análises de dados e relatórios para identificar tendências e oportunidades de melhoria; - Desenvolver e implementar planos de ação para otimizar processos e aumentar a eficiência; - Acompanhar e monitorar indicadores de desempenho; - Elaborar e apresentar relatórios gerenciais; - Participar de projetos estratégicos da empresa.  Requisitos: - Formação superior completa em Administração, Engenharia, Economia ou áreas afins; - Experiência prévia em planejamento, análise de dados e elaboração de relatórios; - Conhecimento avançado em Excel e Power Point; - Habilidade em comunicação e apresentação de resultados.  Se você se identifica com essa vaga e atende aos requisitos, candidate-se agora mesmo através do botão abaixo! Ensino Superior Completo em Engenharia Civil, Elétrica ou Mecânica. Desejável boa experiência na área de planejamento e controle de manutenção/obras. Desejável conhecimento intermediário/avançado em Excel e softwares do pacote office; Desejável conhecimento intermediário em AUTOCAD; Desejável conhecimento em construção e análise de indicadores de desempenho; Desejável conhecimento Microsoft Project. Desejável habilidade de comunicação interpessoal; Desejável pró atividade na busca e resolução de problemas; Desejável conhecimento do escopo e da rotina de manutenção rodoviária; Desejável alta orientação para resultados; Desejável habilidade de realizar análise crítica de dados; Desejável conhecimento de ferramentas de análise de dados; Principais entregas: Solicitações de serviço abertas; Backlog semanal; Estimativa de conclusão do backlog; Matriz de priorização; Folha Tarefa planejada e realizada; Relatórios de desempenho; Relatórios de obrigação contratual; Planilhas de controle.  ";A LAMSA é a concessionária que administra a Linha Amarela, uma das mais importantes vias expressas da cidade do Rio de Janeiro. Os 17,4km de extensão da via expressa ligaram bairros e encurtaram distâncias, revitalizando grande parte da Zona Norte da cidade, com a chegada de diversos empreendimentos comerciais e residenciais. Ao longo dos anos, a LAMSA buscou sempre a inovação como forma de garantir a fluidez do trânsito e a segurança viária de seus usuários em um cenário desafiador de aumento constante do número de veículos. A faixa reversível operada nos dias úteis no sentido Fundão e, mais recentemente, as novas faixas de cobrança eletrônica de pedágio implantadas no centro da via, são ótimos exemplos disso.
Especialista em Bi;DFL Indústria e Comércio S/A;Supervisão/ Coordenação;Publicada há 6 dias;a combinar;Rio de Janeiro;Regime CLT;Assistência médica + Assistência odontológica + Auxílio academia + Auxílio creche + Auxílio farmácia + Café da manhã;Responsabilidades: Perfil Desejado:  Ensino Superior Completo em Tecnologia da Informação, Análise e Desenvolvimento de Sistemas, Ciência da Computação e áreas correlatas.;Trabalhando juntos, nos orgulhamos de ser uma empresa 100% brasileira que exporta para mais de 45 países. Ser uma das maiores indústrias farmacêuticas e de produtos odontológicos da América Latina é o resultado de uma gestão de pessoas e de negócio conectada com o futuro. São 80 anos de história e um projeto de crescer que reflete no desenvolvimento das nossas pessoas e na oferta de oportunidades de carreira. Valorizamos profissionais que estejam abertos a aprender e tenham garra para construir uma carreira promissora na DFL.  Se a modernidade e a inovação te enchem os olhos, junte-se a nós!
Analista de Trade Marketing Sênior;Drogaria Moderna;Sênior;Publicada em 18/09/2024;a combinar;Rio de Janeiro;Regime CLT;Assistência médica + Assistência odontológica + Auxílio academia + Auxílio farmácia + Consignado + Desconto em produtos;"Estamos em busca de um Analista de Trade Marketing Sênior para se juntar à nossa equipe! Se você é apaixonado por marketing e tem experiência em análise de dados, planejamento estratégico e execução de campanhas de trade marketing, essa pode ser a oportunidade perfeita para você.  Responsabilidades: - Desenvolver e implementar estratégias de trade marketing; - Analisar dados de mercado e comportamento do consumidor para identificar oportunidades de negócios; - Gerenciar o orçamento de trade marketing e garantir o retorno sobre o investimento; - Trabalhar em colaboração com outras áreas da empresa para garantir a execução efetiva das campanhas de trade marketing.  Requisitos: - Experiência comprovada em trade marketing, preferencialmente em empresas do varejo; - Conhecimento em análise de dados e planejamento estratégico; - Habilidade em gerenciamento de projetos e orçamento; - Excelente comunicação e habilidades interpessoais.  Se você se encaixa nesse perfil e está procurando por um desafio emocionante em uma empresa em crescimento, clique no botão ""Candidate-se"" abaixo e envie seu currículo. Estamos ansiosos para conhecê-lo! Disponiblidade para viagens.";Já pensou em trabalhar em uma empresa do varejo farmacêutico com mais 50 anos de história e que tem como missão cuidar da saúde, beleza e bem-estar dos seus clientes?   Se a resposta for sim, aqui é o seu lugar!   A Drogaria Moderna é sinônimo de qualidade, excelência e cuidado.   Feito de pessoas e para pessoas, hoje somos um time de mais de 1.200 colaboradores engajados em oferecer o melhor em nossos serviços e responsáveis pelo atendimento de excelência de aproximadamente 10 milhões de clientes todos os anos.   Somos uma empresa que proporciona aprendizado e um ambiente de desenvolvimento, possibilitando o seu crescimento pessoal e profissional.   Nosso time é formado por pessoas com brilho nos olhos e nos orgulhamos em dizer que somos referência nas cidades por onde passamos e oferecemos aos nossos clientes: atendimento personalizado, assistência farmacêutica, laboratório de manipulação, clínicas de vacinação, programa de benefícios (Moderna Mais) e ainda uma incrível loja de departamentos (Moderna Mega Store).    VENHA FAZER PARTE DO NOSSO TIME!   #VemSerDrogariaModerna #OrgulhodeSerDrogariaModerna #DrogariaModerna    Aproveite e conheça mais sobre nós: Site oficial: https://www.drogariamoderna.com.br/ Instagram: https://www.instagram.com/drogariasmoderna/ https://www.instagram.com/modernamanipulacao/ https://www.instagram.com/modernamegastore/ https://www.instagram.com/vacinasdrogariamoderna/ https://www.instagram.com/nutrimaisrestaurante/
Estágio Superior em Sustentabilidade;CSN CIMENTOS;Estágio;Publicada em 13/09/2024;a combinar;Minas Gerais;Estágio;;" JUNTE-SE À CSN Cimentos!  Somos um dos mais eficientes complexos siderúrgicos integrados do mundo, atuando com destaque em cinco setores: Siderurgia, Mineração, Logística, Cimento e Energia. A CSN Cimentos é uma das principais empresas do setor de materiais de construção, com foco em cimento, concreto e agregados. Seus produtos e soluções inovadoras são utilizados em diferentes projetos de construção, desde moradias até obras desafiadoras de infraestrutura. A empresa tem uma gestão focada no desenvolvimento de suas equipes e na convivência harmônica com as comunidades nas cidades onde opera.  Com cerca de 3.000 colaboradores a empresa possui um parque industrial distribuído no Sudeste, Nordeste e Centro-Oeste, com mais de 35 unidades no Brasil. Temos o compromisso de seguir todas as normas e recomendações do Pacto Global de ESG. Nosso foco é aumentar a diversidade, incentivando a inclusão, igualdade, respeito e tolerância às diferenças. A CSN Cimentos é signatária dos Princípios de Empoderamento das Mulheres da ONUe no tema de mulheres na liderança é referência na indústria da construção.  Buscamos atrair e desenvolver profissionais que se identifiquem com a nossa cultura. É certificada como uma das melhores empresas para se trabalhar na Indústria pelo GTPW.  Venha fazer parte da nossa essência: “fazer bem, fazer mais e fazer para sempre""  Incentivamos a candidatura de PCD's e mulheres!";
Especialista de Cimento - Cantagalo/RJ;CSN CIMENTOS;Sênior;Publicada em 30/09/2024;a combinar;Cantagalo;Regime CLT;;" JUNTE-SE À CSN Cimentos!  Somos um dos mais eficientes complexos siderúrgicos integrados do mundo, atuando com destaque em cinco setores: Siderurgia, Mineração, Logística, Cimento e Energia. A CSN Cimentos é uma das principais empresas do setor de materiais de construção, com foco em cimento, concreto e agregados. Seus produtos e soluções inovadoras são utilizados em diferentes projetos de construção, desde moradias até obras desafiadoras de infraestrutura. A empresa tem uma gestão focada no desenvolvimento de suas equipes e na convivência harmônica com as comunidades nas cidades onde opera.  Com cerca de 3.000 colaboradores a empresa possui um parque industrial distribuído no Sudeste, Nordeste e Centro-Oeste, com mais de 35 unidades no Brasil. Temos o compromisso de seguir todas as normas e recomendações do Pacto Global de ESG. Nosso foco é aumentar a diversidade, incentivando a inclusão, igualdade, respeito e tolerância às diferenças. A CSN Cimentos é signatária dos Princípios de Empoderamento das Mulheres da ONUe no tema de mulheres na liderança é referência na indústria da construção.  Buscamos atrair e desenvolver profissionais que se identifiquem com a nossa cultura. É certificada como uma das melhores empresas para se trabalhar na Indústria pelo GTPW.  Venha fazer parte da nossa essência: “fazer bem, fazer mais e fazer para sempre""  Incentivamos a candidatura de PCD's e mulheres!";
Assistente de Tráfego (Monitoramento);Empresa Vitória;Auxiliar/ Operacional;Publicada há 5 dias;a combinar;Ceará;Regime CLT;Assistência médica + Assistência odontológica + Bicicletário + Cesta básica + Convênio com empresas parceiras + Refeitório;"O que buscamos:  Se você é um (a) profissional organizado (a), com capacidade analítica, comunicação clara e efetiva e tem senso de liderança, a vaga é para você!  Principais responsabilidades:  • Desenvolver planos de ação corretivos e preditivos, visando a prevenção de incidentes e melhoria contínua; • Reportar informações críticas ao supervisor imediato, auxiliando na prevenção de sinistros; • Criar e controlar banco de dados e planilhas de acompanhamento; • Gerar relatórios que auxiliem na análise de ocorrências e na comparação de dados programados versus realizados; • Administrar o processo de apuração de sinistros: análise de orçamento, identificação do responsável, cobrança e ações corretivas; • Cruzar dados das imagens com registros operacionais para gerar relatórios e identificar inconformidades; • Acompanhar recebimento e registro de sugestões, reclamações e solicitações de informações de clientes, garantindo o atendimento e retorno eficiente e preciso.  O que você precisa ter:  • Ensino superior completo ou em andamento nas áreas de Logística, Administração, Engenharia de Produção ou áreas afins; • Excel intermediário (necessário utilizar fórmulas, gráficos e tabelas dinâmicas); • Vivência com ferramentas ERP; • Necessária boa experiência, comprovada, em setores de monitoramento ou controle operacional, especialmente em empresas de transporte ou logística; • Vivência no gerenciamento de sinistros e no cruzamento de dados operacionais com análise de imagens; • Vivência em liderança de equipes; • Disponibilidade para trabalhar em Caucaia/CE.";Somos uma empresa que presta serviço de transporte público de passageiros, operando no Sistema Metropolitano de Fortaleza - RMF e no Urbano do Município de Caucaia, tendo como filosofia a interação com a comunidade, a responsabilidade social, a sustentabilidade, a valorização dos nossos clientes e colaboradores, o que nos faz ser há mais de 68 anos uma das melhores no segmento de transporte coletivo, sempre comprometida com a qualidade e valorização do potencial humano.    A Vitória é a única empresa a operar no transporte publico na maior cidade do Brasil que possui tarifa zero, e em 2023 foi eleita a melhor empresa do Sistema Metropolitano para se trabalhar, segundo pesquisa de clima realizada pelo SINDIONIBUS.  Propósito: Impactar positivamente a vida das pessoas buscando constantemente excelência, inovação e sustentabilidade naquilo que fazemos.  Valores:   Ciente de seu papel fundamental na construção de um futuro equitativo e ambientalmente saudável têm adotado práticas voltadas para o equilíbrio entre o progresso econômico, social e ambiental, para isso criou o Programa Vitória Verde para promover práticas e ações sociais e ambientais, visando o desenvolvimento sustentável e com o propósito de conciliar o progresso econômico com a equidade social e a preservação ambiental, buscando soluções inovadoras e responsáveis, alinhadas aos ODSs.  Acesse nosso site para conhecer mais sobre a empresa: https://www.evitoria.com.br/
Estagiário;Confidencial;Estágio;Publicada em 26/09/2024;R$ 1.400;Rio de Janeiro;Estágio;Café da manhã + Desconto em produtos + Restaurante interno + Vale-transporte;• Fechamento de Custos: Auxiliar no processo de fechamento mensal de custos, garantindo que todas as informações estejam corretas e prontas para serem reportadas. • Relatórios e Indicadores: Criar e atualizar relatórios de custos e indicadores financeiros, proporcionando suporte à tomada de decisão da empresa. • Apoio ao Controle de Custos: Colaborar com a equipe na análise e no controle dos custos operacionais, identificando variações e sugerindo possíveis melhorias. • Análise de Dados: Participar da coleta e análise de dados relacionados aos custos, ajudando a identificar tendências e oportunidades de economia.  • Proatividade e vontade de aprender. • Atenção aos detalhes e capacidade de trabalhar com precisão. • Boa comunicação e habilidade para trabalhar em equipe. • Organização e gestão de tempo para lidar com prazos. ;
Especialista de Garantia de Qualidade;União Química Farmacêutica Nacional S/A;Sênior;Publicada em 24/09/2024;a combinar;Pouso Alegre;Regime CLT;Assistência médica + Assistência odontológica + Auxílio fretado + Café da manhã + Cesta de natal + Consignado;"Requisitos - Superior completo em Farmácia ou Química - Vivência na área de Controle de Qualidade - Conhecimentos em análises laboratoriais, incluindo equipamentos de alta complexidade, e ferramentas da qualidade - Rotina com análises de controle de qualidade, investigações de ocorrências analíticas e resultados analíticos fora de tendência/especificação, avaliação de integridade de dados e análises de tendência - Inglês intermediário; - Legislações vigentes: RDC 658/2022 (Boas Práticas de Fabricação); RDC 512/2021 (Boas Práticas Laboratoriais);   Principais atividades - Auxiliar nas investigações de ocorrências analíticas e resultados analíticos fora de tendência/especificação, propondo ações corretivas e preventivas sempre que necessário. - Executar avaliações relacionadas a integridade de dados laboratoriais. - Desenvolver relatórios de tendência para análise dos dados. Inglês - Nível Intermediário Habilidades interpessoais: ser proativo, dinâmico.";Conheça a União Química: Que tal trabalhar em uma empresa que está posicionada como uma das maiores, mais sólidas e inovadoras empresas do ramo farmacêutico?  Com capital 100% nacional e mais de 86 anos de trajetória, fornecemos produtos de alta qualidade a custos cada vez mais competitivos, por meio da atuação de nossas cinco unidades de negócios:     A União Química possui orgulho de sua trajetória e busca construir um futuro ainda mais brilhante. Com uma visão sempre inovadora e focada no cliente, buscamos talentos que contribuam para a construção de uma empresa que busca renovação em cada nova etapa, no desenvolvimento de seus produtos e na condução de seus negócios. Se identificou? Gosta de desafios? Venha fazer parte da União Química!
Técnico de Qualidade;Lactalis do Brasil - Comércio, Importação e Exportação de La;Técnico;Publicada há 2 dias;a combinar;Rio Grande do Sul;Regime CLT;Assistência médica + Assistência odontológica + Auxílio creche + Desconto em produtos + Participação nos Lucros ou Resultados + Programa de treinamentos;" Necessário conhecimento prévio na área de tecnologia e processamento de alimentos; Ferramentas da qualidade. ";Você já conhece o grupo LACTALIS? Uma empresa familiar Francesa, que iniciou sua trajetória com a fabricação de 17 queijos e, com muita RESPONSABILIDADE, COMPROMETIMENTO, QUALIDADE e SABOR nos produtos, hoje é líder mundial do setor de laticínios! Sabemos que isso não seria possível sem contar com a alta EXPERTISE e DIVERSIDADE dos nossos mais de 85 mil colaboradores APAIXONADOS PELO LEITE! Então, se você quer fazer parte dessa jornada incrível, de uma empresa FORTE e RESPONSÁVEL, independentemente de raça, orientação sexual, crenças ou religião, você é bem-vindo a se candidatar a esta oportunidade: Uma paixão em comum: o amor pelo leite.
Analista de Controladoria Sr;Confidencial;Sênior;Publicada em 27/09/2024;a combinar;São Paulo;Regime CLT;Assistência médica + Assistência odontológica + Auxílio academia + Convênio com empresas parceiras + Desconto em produtos + Horário flexível;Inglês - Nível Avançado;
Analista Planejamento de Peças;XCMG Brasil Indústria;Sênior;Publicada em 30/09/2024;a combinar;Contagem;Regime CLT;Assistência médica + Assistência odontológica + Auxílio academia + Auxílio farmácia + Auxílio fretado + Participação nos Lucros ou Resultados;"Gerenciar estoque de peças, desenvolvendo estratégias para otimizar custos; Realizar auditorias de inventário e corrigir discrepâncias; Analisar dados e usar ferramentas de planejamento para prever demanda e ajustar reabastecimentos; Coordenar com fornecedores para garantir entregas no prazo e negociar contratos; Gerar relatórios de desempenho e implementar KPIs para monitorar eficiência; Apresentar relatórios e recomendações para a alta gestão com base em análises de dados. Formação superior em Engenharia Mecânica, Elétrica, Produção e/ou afins; Excel intermediário ou superior; Conhecimento em Power BI; Experiência com SAP (diferencial); Conhecimento técnico em caminhões.";Fundada em 1943, a XCMG é o maior grupo de empresas na indústria de maquinário de construção da China, com a maior variedade e série de produtos, e a mais competitiva e influente no setor. A XCMG ocupa atualmente o3° lugar na indústria mundial de maquinário de construção, e o 1° lugar na China.  Desde 2004 no mercado brasileiro, a XCMG reafirma, cada dia mais, seu concreto investimento no território nacional e latino-americano. Irreverente ao importar produtos chineses no país, em 2014 a XCMG iniciou a sua linha de produção na cidade de Pouso Alegre/MG, que com sua localização estratégica na rodovia Fernão Dias, estreitou ainda mais os laços da marca com um mercado que, cada vez mais, exige qualidade, tecnologia e inovação.
Técnico em Segurança do Trabalho;Confidencial;Técnico;Publicada há 5 dias;R$ 3.000 a R$ 3.700;São Paulo;Regime CLT;Assistência médica + Assistência odontológica + Auxílio combustível + Cesta de natal + Restaurante interno + Seguro de vida;"Requisitos:      Descrição da Vaga: Analisar criticamente dados estatísticos e indicadores; Emitir PPP; Acompanhar Perícias; Elaborar e Revisar Ordem de Serviço; Elaborar análise de risco; Realizar inspeções de segurança, registrar e tratar as não conformidades; Ministrar treinamentos, DDS e desenvolver ações educativas; Investigar, analisar ocorrências de acidentes e recomendar medidas de prevenção e controle; Requisitar e controlar a entrega EPI´S; Controlar vencimento e lançamento dos ASOS; Atualizar e disponibilizar a FISQP; Controlar e lançar dados no ERP TOTVS; Cumprir e fazer cumprir os procedimentos da segurança no trabalho, higiene, qualidade e proteção ao meio ambiente.";
Analista de Projetos;Xcelis Solutions;Pleno;Publicada em 19/09/2024;a combinar;São Paulo;Associado;Assistência médica + Assistência odontológica + Seguro de vida + Vale-refeição;"Auxiliar em entrevistas com clientes para coletas de dados; Analisar bases de dados com o foco de diagnosticar oportunidades de melhoria de custos, produtividade, processos e serviços baseados em dados do cliente; Apoiar a elaboração de apresentações para reuniões de status com clientes; Auxiliar no gerenciamento das agendas com clientes e equipe de projeto; Realizar suporte as ações planejadas no projeto nas atividades de desenho e implantação. Inglês - Nível Avançado Ensino superior cursando ou completo em Engenharia, Administração, Logística ou áreas afins; Conhecimento em logística; Conhecimento em transportes; Excel avançado; Inglês Avançado;";Quem somos? A Xcelis é composta por um time de especialistas em Supply Chain, temos mais de 15 anos otimizando e transformando resultados de empresas do Brasil e exterior. Atuamos de ponta a ponta na cadeia, indo do desenho à implantação com projetos de otimização de performance e resultados em Supply Chain olhando para Malha Logística, Transportes, Warehouse, Planning, E-Commerce/Omnichannel, Procurement, Tecnologia e Torre de Controle. Somos certificados em Clima Organizacional pela FEEx 2023 e 2024, eleitos como líderes como Supply Chain Advisory and Consulting Services e Contender no quadrante Supply Chain IT Operation Services do estudo ISG Provider Lens™ Supply Chain Services Brazil 2023 e também premiados em 2023, como 1º lugar pelo INBRASC como Consultoria Logística e Fornecedor de TMS!  Nossos valores Nosso trabalho é baseado em um forte conjunto de valores voltados ao comprometimento, à entrega efetiva e ao trabalho lado a lado com nossos clientes, nossos valores são: COMPROMETIMENTO, INTEGRAÇÃO, EXPERTISE, DINAMISMO, VERSATILIDADE, INTEGRIDADE E EXCELÊNCIA.  Todas as nossas vagas são Extensivas para Pessoas com Deficiência - PCD.
Técnico (a) Manutenção;Samarco;Técnico;Publicada há 2 dias;a combinar;Minas Gerais;Regime CLT;; Sobre a vaga Que tal trabalhar em uma empresa que valoriza pessoas, integridade, mobilização para os resultados e segurança das equipes? Estamos à procura de talentos que desejem se juntar a nós nesta jornada. Veja essa oportunidade para nosso banco de talentos.  Sobre a Samarco Empresa de capital fechado que atua no segmento de mineração, uma joint venture de propriedade da Vale e BHP. Com sede em Belo Horizonte (MG), temos unidades operacionais em Minas Gerais e no Espírito Santo. Nosso principal produto são as pelotas de minério de ferro, matéria-prima para a produção de aço pela indústria siderúrgica. Retomamos as operações de uma maneira diferente, com novas tecnologias e mais segurança, buscando gerar valor duradouro para o território onde atuamos.  Recado Importante Na Samarco os Direitos Humanos e a Diversidade, Equidade e Inclusão são pilares relevantes de gestão. Por isso, incentivamos que pessoas com deficiência, diferentes raças, identidades de gênero e orientações sexuais se candidatem às vagas. Incentivamos a busca por melhores desempenhos respeitando a identidade de todas as pessoas, sem discriminações. Acreditamos que só assim será possível construir uma mineração diferente.;
Analista de Documentação Jr (Lem);Merieux Nutrisciences;Júnior/ Trainee;Publicada em 16/09/2024;a combinar;Piracicaba;Regime CLT;Assistência médica + Assistência odontológica + Auxílio fretado + Café da manhã + Convênio com empresas parceiras + Participação nos Lucros ou Resultados;;Nossa missão A Mérieux NutriSciences dedica-se a proteger a saúde dos consumidores em todo o mundo, oferecendo uma vasta gama de soluções em análises e estudos às empresas dos setores de alimentos, água e meio ambiente, agroquímicos, fármacos e bens de consumo.   Nossa visão Seguindo os passos da família Mérieux e Dr. Silliker, colocamos a saúde e o bem-estar dos consumidores no centro das nossas atividades. Fornecemos os melhores serviços aos nossos clientes para ajudá-los a garantir a segurança e qualidade de seus produtos e prevenir riscos à saúde.   Nossos valores Colaboração Equilíbrio na Vida Empoderamento Empreendedorismo Relações Autênticas    Nossos números no mundo Estamos presentes em 27 países. Temos mais de 8000 colaboradores comprometidos com as necessidades dos nossos clientes. Operamos mais de 100 laboratórios acreditados em todo o mundo.  A Mérieux Nutrisciences acredita na igualdade de oportunidades. Independentemente de gênero, idade, raça, cor, credo, orientação sexual e deficiência, todos os candidatos qualificados serão considerados em nossos processos.
